{
  "$schema": "./schema/gateway.schema.json",
  "bind": ":30709",
  "site": {
    "title": "Gateway",
    "tagline": "One ingress, several apps. Pick one.",
    "fallbackIcon": "📦"
  },
  "paths": {
    "project": "../../project",
    "playround": "..",
    "crawler": "../../tools/Crawler"
  },
  "ports": "../../PORTS.md"
}
